{
  "meta": {
    "slug": "karty-rutyn",
    "tytul": "Karty rutyn: poranek i wieczór",
    "podtytul": "48 kart i tablica",
    "archetyp": "KARTY",
    "wersja": "1.0",
    "wiek": "3–7 lat",
    "kategoria": "rutyny",
    "podkategoria": "plan-dnia",
    "strony_deklarowane": 56,
    "min_pt_dziecka": 14
  },
  "wstep": {
    "dla_kogo": "Dla domu, w którym poranek to codziennie ta sama awantura.",
    "obietnica": "Dziecko samo przechodzi przez poranek i wieczór, przesuwając kartę po każdej zrobionej rzeczy — bez przypominania za każdym razem.",
    "warunek_wejscia": "Dziecko rozpoznaje przedmioty na obrazkach i potrafi wykonać prostą czynność samodzielnie. Czytać nie musi.",
    "ile_czasu_dziennie": "Pierwszy tydzień: dziesięć minut dziennie razem przy tablicy. Potem tyle, ile trwa sam poranek.",
    "jak_korzystac": [
      "Wydrukuj najpierw samą talię poranną. Wieczorną dołóż za tydzień.",
      "Wybierz osiem kart, nie dwadzieścia cztery. Resztę odłóż do pudełka.",
      "Ustalcie kolejność razem, przy stole, zanim cokolwiek powiesisz.",
      "Powieś tablicę na wysokości oczu dziecka, przy drzwiach albo w łazience.",
      "Przez pierwszy tydzień przechodź z dzieckiem kartę po karcie.",
      "Kiedy osiem kart działa bez przypominania, dołóż dwie kolejne.",
      "Karty pokazują kolejność. Nie stawiaj przy nich punktów ani naklejek."
    ],
    "czego_nie_robi": [
      "To nie jest system nagród ani kar. Karty pokazują kolejność, nie oceniają.",
      "Nie zadziała sama z siebie. Przez pierwszy tydzień przechodzicie przez nie razem.",
      "Nie zastępuje rozmowy o tym, dlaczego rano trzeba wyjść z domu o ósmej.",
      "To nie jest terapia ani diagnoza. To narzędzie do ułożenia dnia w domu."
    ],
    "kiedy_do_specjalisty": "Jeśli po dwóch miesiącach poranek wygląda tak samo jak przed kartami, porozmawiaj z pediatrą przy najbliższej wizycie. To nie znaczy, że coś jest nie tak. Znaczy, że warto zapytać."
  },
  "talie": [
    {
      "nazwa": "Poranek",
      "format_mm": [
        65,
        90
      ],
      "bez_podpisow": true,
      "arkusze": [
        {
          "id": "por-przygotowanie",
          "typ": "lista_krokow",
          "polecenie": "Przygotuj talię poranną.",
          "dla_rodzica": "Zrób to raz, wieczorem, bez dziecka. Zajmuje kwadrans.",
          "dane": {
            "kroki": [
              "Wydrukuj sześć kolejnych arkuszy. Zwykły papier wystarczy.",
              "Potnij karty po liniach. Zostaw trzy milimetry marginesu.",
              "Zalaminuj albo oklej taśmą — karty przetrwają mokre ręce.",
              "Przyklej rzep albo magnes na odwrocie każdej karty.",
              "Powieś tablicę na wysokości oczu dziecka, nie swoich.",
              "Zacznij od ośmiu kart. Resztę dołóżcie za tydzień."
            ]
          }
        },
        {
          "id": "por-karty-1",
          "typ": "karty_do_wyciecia",
          "polecenie": "Wytnij karty po liniach.",
          "dla_rodzica": "Wersja z podpisami. Dla dziecka, które czyta albo rozpoznaje wyrazy.",
          "dane": {
            "karty": [
              {
                "awers": "Wstań z łóżka.",
                "rewers": "poranek"
              },
              {
                "awers": "Pościel łóżko.",
                "rewers": "poranek"
              },
              {
                "awers": "Odsłoń zasłony.",
                "rewers": "poranek"
              },
              {
                "awers": "Idź do toalety.",
                "rewers": "poranek"
              },
              {
                "awers": "Umyj ręce.",
                "rewers": "poranek"
              },
              {
                "awers": "Umyj buzię.",
                "rewers": "poranek"
              },
              {
                "awers": "Umyj zęby.",
                "rewers": "poranek"
              },
              {
                "awers": "Uczesz włosy.",
                "rewers": "poranek"
              }
            ],
            "na_arkuszu": 8,
            "z_podpisami": true
          }
        },
        {
          "id": "por-karty-2",
          "typ": "karty_do_wyciecia",
          "polecenie": "Wytnij karty po liniach.",
          "dla_rodzica": "Wersja z podpisami. Dla dziecka, które czyta albo rozpoznaje wyrazy.",
          "dane": {
            "karty": [
              {
                "awers": "Zdejmij piżamę.",
                "rewers": "poranek"
              },
              {
                "awers": "Ubierz bieliznę i skarpetki.",
                "rewers": "poranek"
              },
              {
                "awers": "Włóż spodnie.",
                "rewers": "poranek"
              },
              {
                "awers": "Włóż koszulkę.",
                "rewers": "poranek"
              },
              {
                "awers": "Włóż sweter.",
                "rewers": "poranek"
              },
              {
                "awers": "Nakryj do stołu.",
                "rewers": "poranek"
              },
              {
                "awers": "Zjedz śniadanie.",
                "rewers": "poranek"
              },
              {
                "awers": "Odnieś talerz do zlewu.",
                "rewers": "poranek"
              }
            ],
            "na_arkuszu": 8,
            "z_podpisami": true
          }
        },
        {
          "id": "por-karty-3",
          "typ": "karty_do_wyciecia",
          "polecenie": "Wytnij karty po liniach.",
          "dla_rodzica": "Wersja z podpisami. Dla dziecka, które czyta albo rozpoznaje wyrazy.",
          "dane": {
            "karty": [
              {
                "awers": "Wypij szklankę wody.",
                "rewers": "poranek"
              },
              {
                "awers": "Nakarm zwierzaka.",
                "rewers": "poranek"
              },
              {
                "awers": "Spakuj plecak.",
                "rewers": "poranek"
              },
              {
                "awers": "Włóż bidon do plecaka.",
                "rewers": "poranek"
              },
              {
                "awers": "Weź czapkę.",
                "rewers": "poranek"
              },
              {
                "awers": "Załóż buty.",
                "rewers": "poranek"
              },
              {
                "awers": "Załóż kurtkę.",
                "rewers": "poranek"
              },
              {
                "awers": "Wyjdź z domu.",
                "rewers": "poranek"
              }
            ],
            "na_arkuszu": 8,
            "z_podpisami": true
          }
        },
        {
          "id": "por-rysunkowe-1",
          "typ": "karty_do_wyciecia",
          "polecenie": "Narysuj na pustych kartach.",
          "dla_rodzica": "Wersja dla dziecka, które nie czyta. Pole na karcie jest puste — dziecko rysuje czynność albo wklejacie zdjęcie. Opis pod ramką jest dla ciebie, nie dla dziecka.",
          "dane": {
            "karty": [
              {
                "awers": "Wstawanie z łóżka",
                "rewers": "poranek"
              },
              {
                "awers": "Ścielenie łóżka",
                "rewers": "poranek"
              },
              {
                "awers": "Odsłanianie zasłon",
                "rewers": "poranek"
              },
              {
                "awers": "Toaleta",
                "rewers": "poranek"
              },
              {
                "awers": "Mycie rąk",
                "rewers": "poranek"
              },
              {
                "awers": "Mycie buzi",
                "rewers": "poranek"
              },
              {
                "awers": "Mycie zębów",
                "rewers": "poranek"
              },
              {
                "awers": "Czesanie włosów",
                "rewers": "poranek"
              }
            ],
            "na_arkuszu": 8,
            "z_podpisami": false
          }
        },
        {
          "id": "por-rysunkowe-2",
          "typ": "karty_do_wyciecia",
          "polecenie": "Narysuj na pustych kartach.",
          "dla_rodzica": "Wersja dla dziecka, które nie czyta. Pole na karcie jest puste — dziecko rysuje czynność albo wklejacie zdjęcie. Opis pod ramką jest dla ciebie, nie dla dziecka.",
          "dane": {
            "karty": [
              {
                "awers": "Zdejmowanie piżamy",
                "rewers": "poranek"
              },
              {
                "awers": "Bielizna i skarpetki",
                "rewers": "poranek"
              },
              {
                "awers": "Spodnie",
                "rewers": "poranek"
              },
              {
                "awers": "Koszulka",
                "rewers": "poranek"
              },
              {
                "awers": "Sweter",
                "rewers": "poranek"
              },
              {
                "awers": "Nakrywanie do stołu",
                "rewers": "poranek"
              },
              {
                "awers": "Śniadanie",
                "rewers": "poranek"
              },
              {
                "awers": "Talerz do zlewu",
                "rewers": "poranek"
              }
            ],
            "na_arkuszu": 8,
            "z_podpisami": false
          }
        },
        {
          "id": "por-rysunkowe-3",
          "typ": "karty_do_wyciecia",
          "polecenie": "Narysuj na pustych kartach.",
          "dla_rodzica": "Wersja dla dziecka, które nie czyta. Pole na karcie jest puste — dziecko rysuje czynność albo wklejacie zdjęcie. Opis pod ramką jest dla ciebie, nie dla dziecka.",
          "dane": {
            "karty": [
              {
                "awers": "Szklanka wody",
                "rewers": "poranek"
              },
              {
                "awers": "Karmienie zwierzaka",
                "rewers": "poranek"
              },
              {